{"base_pipeline_profile":{"profile_id":"candidate-empty","profile_sha256":"f6bdd8d5941c6eb19533fa6c52e7288f56f480a02411c68356f7b6570b4fc0c4"},"candidate_registry_sha256":"c6a095751a9efcda82ecfa91619859c39bc4497112cfa21bedbe52d33236e2c7","matrix_id":"candidate-evaluation-2026-r1-singles","pass_registry_sha256":"09dddb4c93e7709810c1583b9c73340abfa8369e814b8d075c759f3d782f5db1","profiles":[{"candidate_ids":[],"enabled_candidate_ids":[],"kind":"candidate_empty","path":"docs/optimization/data/candidates/profiles-2026-r1/profiles/candidate-empty-5d1ed4851262.json","profile_id":"candidate-empty","profile_sha256":"f6bdd8d5941c6eb19533fa6c52e7288f56f480a02411c68356f7b6570b4fc0c4"},{"candidate_ids":["candidate.extended-affine-summarization"],"enabled_candidate_ids":["candidate.extended-affine-summarization"],"kind":"single","path":"docs/optimization/data/candidates/profiles-2026-r1/profiles/full-candidate.extended-affine-summarization-9efd992d4e30.json","profile_id":"full+candidate.extended-affine-summarization","profile_sha256":"2ff59c67ac1cbf53f4e09533402bdfef7f8a4ee7f616e229109569bab42c99dc"},{"candidate_ids":["candidate.finite-state-acceleration"],"enabled_candidate_ids":["candidate.finite-state-acceleration"],"kind":"single","path":"docs/optimization/data/candidates/profiles-2026-r1/profiles/full-candidate.finite-state-acceleration-62222774326f.json","profile_id":"full+candidate.finite-state-acceleration","profile_sha256":"56343aadef45a962f218617de2d738eefd3594e6ae20893c05167b2aa524d23c"},{"candidate_ids":["candidate.same-domain-loop-fusion"],"enabled_candidate_ids":["candidate.same-domain-loop-fusion"],"kind":"single","path":"docs/optimization/data/candidates/profiles-2026-r1/profiles/full-candidate.same-domain-loop-fusion-15a57edee117.json","profile_id":"full+candidate.same-domain-loop-fusion","profile_sha256":"702195e5d2e4dc33c87d4fe63c05a20406312c62dce6bd10ae346e1a963257eb"},{"candidate_ids":["candidate.integer-linear-transition"],"enabled_candidate_ids":["candidate.integer-linear-transition"],"kind":"single","path":"docs/optimization/data/candidates/profiles-2026-r1/profiles/full-candidate.integer-linear-transition-82a1e14ae0fa.json","profile_id":"full+candidate.integer-linear-transition","profile_sha256":"fbcef4f9331bb7d6d374f2926d62ef34cf5835fa35ad78dd027e83b58d44b86d"},{"candidate_ids":["candidate.rrt2-on-demand-memoization"],"enabled_candidate_ids":["candidate.rrt2-on-demand-memoization"],"kind":"single","path":"docs/optimization/data/candidates/profiles-2026-r1/profiles/full-candidate.rrt2-on-demand-memoization-25101f6e0758.json","profile_id":"full+candidate.rrt2-on-demand-memoization","profile_sha256":"5ba924aa20b08df0bfa2e2884c222063e6f00af52377204091a09fc3a67ab31f"},{"candidate_ids":["candidate.prefix-scan-reuse"],"enabled_candidate_ids":["candidate.prefix-scan-reuse"],"kind":"single","path":"docs/optimization/data/candidates/profiles-2026-r1/profiles/full-candidate.prefix-scan-reuse-bcffd73205e8.json","profile_id":"full+candidate.prefix-scan-reuse","profile_sha256":"04badf7ce1efaccc7222b74050478486d403b82e26795abe84dc3937565cbde1"}],"schedule":[{"baseline_profile_id":"candidate-empty","candidate_ids":["candidate.extended-affine-summarization"],"candidate_profile_id":"full+candidate.extended-affine-summarization","comparison_direction":"baseline_over_variant","kind":"single"},{"baseline_profile_id":"candidate-empty","candidate_ids":["candidate.finite-state-acceleration"],"candidate_profile_id":"full+candidate.finite-state-acceleration","comparison_direction":"baseline_over_variant","kind":"single"},{"baseline_profile_id":"candidate-empty","candidate_ids":["candidate.same-domain-loop-fusion"],"candidate_profile_id":"full+candidate.same-domain-loop-fusion","comparison_direction":"baseline_over_variant","kind":"single"},{"baseline_profile_id":"candidate-empty","candidate_ids":["candidate.integer-linear-transition"],"candidate_profile_id":"full+candidate.integer-linear-transition","comparison_direction":"baseline_over_variant","kind":"single"},{"baseline_profile_id":"candidate-empty","candidate_ids":["candidate.rrt2-on-demand-memoization"],"candidate_profile_id":"full+candidate.rrt2-on-demand-memoization","comparison_direction":"baseline_over_variant","kind":"single"},{"baseline_profile_id":"candidate-empty","candidate_ids":["candidate.prefix-scan-reuse"],"candidate_profile_id":"full+candidate.prefix-scan-reuse","comparison_direction":"baseline_over_variant","kind":"single"}],"schema_version":"candidate-profile-matrix.v1"}
